Timestamp,Tweet Content
2025-04-23T23:58:28.000Z,"President Donald Trump is leveraging historical contexts to bolster his tariff strategy, though the figures aren't entirely consistent."
2025-04-23T23:53:41.000Z,"One thing I don’t get. We had the tariff experience of the 1930s. Obviously Trump learned nothing from that, but it makes very little sense to me to think that nobody else learned anything and that now everybody is automatically going to repeat the same mistakes in a trade war."
2025-04-23T23:35:37.000Z,US TOLD JAPAN IT CANNOT RECEIVE SPECIAL TARIFF TREATMENT IN RECENT TALKS – NHK || DISCUSSION TOOK PLACE EARLIER THIS MONTH || CITED BY MULTIPLE JAPANESE GOVERNMENT SOURCES
2025-04-23T23:36:24.000Z,"US not giving Japan special tariff treatment ‍ Just like in crypto, no shortcuts in the trade game. It's all about fair play and courage, Akita style! Let's navigate these global market waves together, fam!"
2025-04-23T23:47:11.000Z,"im surprised that the markets are so whipsawed and surprised with the Trump headlines on tariffs, rates, powell etc.    psst   this happened almost verbatim in 2018. including the dips and rallies.   :-)    T: tariff, Xi: back at ya. T: ok if no deal. xi: i don't negotiate blabla"
2025-04-23T23:32:52.000Z,"Where are our $5,000 DOGE reimbursement checks Elon & Trump promised us? We could certainly use it to cover the cost of Trump's tariff tax on the purchase of a new car. "
2025-04-23T23:38:33.000Z,"Sir, do you really think that anyone in this  ""IKEA cabinet"" knows what CapEx is?  They clearly still don't know what a Tariff is."
2025-04-23T23:00:02.000Z,"$JPM and $MS soar on Q1 earnings, but Jamie Dimon’s warning of “considerable turbulence” has markets spooked. Are banks the last safe haven, or is this a trap before the tariff storm hits? Pick a lane! 
$JPM $BAC $C $WFC $GS $MS $USB $PNC $SCHW $BK $AXP $TD $HSBC $V $MA $EDXC"
2025-04-23T23:34:32.000Z,"US nixes special tariff treatment for Japan Standard trade policies reign supreme. Akita style advice: Expect the unexpected, stay courageous and always be ready for a quick pivot. Just like in the world of crypto, there's no special treatment. Adapt and HODL on, fam!"
2025-04-23T23:21:59.000Z,"A dozen states sue the Trump administration to stop tariff policy https://yahoo.com/news/dozen-states-sue-trump-administration-205131500.html?soc_src=social-sh&soc_trk=tw&tsrc=twtr… via @
@YahooNews"
2025-04-23T23:20:11.000Z,"Trump floats automobile tariff increase for Canada #Unifor https://stcatharinesstandard.ca/business/trump-floats-automobile-tariff-increase-for-canada/article_6a08bd06-812d-5e4c-b37a-7263a7f7dd83.html?utm_medium=social&utm_source=twitter&utm_campaign=user-share… via 
@stcatstandard"
2025-04-23T22:56:19.000Z,"Businesses are already trying to pass tariff costs onto customers, Fed report says"
2025-04-23T23:14:48.000Z,"A dozen states sue the Trump administration to stop tariff policy - A dozen states have sued the Trump administration in the U.S. Court of International Trade to stop its tariff policy, challenging Trump's claim that he could arbitrarily impose tariffs b…"
2025-04-23T23:11:02.000Z,"Risk Rally: the rally from the bottom has taken BTC 25% higher, NDX 12% higher and China stocks 12% higher in just a couple of weeks.

The drivers were 1)depressed valuation: 2)a 90-day halt for non-China then 3)a much lower tariff for China.

Will this rally continue from here?"
2025-04-23T23:09:27.000Z,Just watched a car dealer commercial for a “pre tariff sale”…we are cooked
2025-04-23T23:42:43.000Z,Oh. Lot of people are gonna fall for the new group chat scam just cause it mentions the word “tariff” and the makes their brain short circuit.
2025-04-23T23:17:29.000Z,NPR: A dozen states sue the Trump administration to stop tariff policy
2025-04-23T23:43:40.000Z,there have now been three changes to tariff policy today (Trump walking back his previous statement and the FT reporting that there would be destacking of China/ateel tariffs for automakers)
2025-04-23T23:30:13.000Z,Here's why tariffs aren't yet forcing a reckoning on pay raises.
2025-04-23T23:45:43.000Z,"New episode from the ""All Things Considered"" Podcast: How the tariff conflict is playing out against the backdrop of Canada's election https://ift.tt/v2MFtNd 
https://ift.tt/fa9hFuc
April 23, 2025 at 05:01PM"
2025-04-23T23:32:52.000Z,Stellantis’s Tariff Plan: Cut Jobs and Reward Shareholders https://msn.com/en-us/money/companies/stellantis-s-tariff-plan-cut-jobs-and-reward-shareholders/ar-AA1DsIrr?ocid=socialshare…
2025-04-23T23:48:59.000Z,"Ireland, we'll tariff the hell outta you over this!"
