Timestamp,Tweet Content
2025-04-23T23:55:09.000Z,"President Trump's tariff strategy remains unclear. While he said a decision on China tariffs could come soon, CBS News' 
@margbrennan
 reports his treasury secretary said it may take two to three years to rebalance trade and no new negotiations are currently scheduled."
2025-04-23T23:38:11.000Z,"This week launched the next chapter of tariff wars and showcased shareholders' reactions to Tesla's earnings. With the week only halfway through, watch the video for major Bitcoin levels and stay tuned to see how the drama unfolds!"
2025-04-23T23:27:08.000Z,Trump's Tariff Tango: Cranes in the Crossfire!
2025-04-23T23:44:54.000Z," Dropping tariffs won’t save us.

Michael Reddell explains why small countries like NZ have little leverage in a Trump trade war.  

 And did you know that NZ has a 10% tariff on imported ambulances? 

 Watch here: https://rcr.media/view/394135"
2025-04-23T23:32:54.000Z,"""Why Should We Care if China Gains Influence Because of U.S. Tariffs?""

Mark Lambert, retired head of the State Department’s China House, shares insights into the impacts of America’s new tariff policy from his extensive diplomatic career in Asia, including postings in China,"
2025-04-23T23:39:50.000Z,1st pair of flip flops made in the USA after the tariff war.
2025-04-23T23:20:41.000Z,"Premier Danielle Smith earlier vowed to act as the ""good cop"" in tariff negotiations with the U.S., aiming to persuade U.S. officials to reconsider their position.

READ MORE: https://rebelne.ws/3YKZMkp"
2025-04-23T23:38:00.000Z,"Hog farmers anticipate rising costs due to China's 135% tariff on U.S. soybean imports, a crucial animal feed ingredient. As China seeks to boost self-sufficiency, it is turning to Brazilian producers to fulfill its soybean needs.
https://rfa.org/english/china/2025/04/22/china-us-tariff-hog-farmers/…

#China #tariff #trade"
2025-04-23T23:09:16.000Z,"Pierre-Olivier Gourinchas, Chief Economist and Director of the IMF’s Research Department, explains how U.S. tariff policies and response measures from other countries are impacting the global economy. The IMF has revised its global growth forecast for 2025 down from 3.3% to 2.8%."
2025-04-23T23:17:19.000Z,"Here comes the tariff endgame. 30% tax breaks to ppl making >$500k, 1% tax breaks for everyone under $200k.

But taxes “lowered” for everyone."
2025-04-23T23:36:18.000Z,"Twelve states filed a lawsuit Wednesday challenging the legality of President Donald Trump's broad tariff agenda, arguing it unlawfully undermines Congress' constitutional authority to regulate foreign commerce.

The legal challenge, led by Arizona Attorney General Kris Mayes and"
2025-04-23T23:36:33.000Z,I wish Goodsmile would let me cancel my pre orders like sorry I didn’t know I would get a 145% tariff fee an ENTIRE year ago….i am lowkey cooked!
2025-04-23T22:59:19.000Z,"I’m just trying to understand the rules here. 

According to the democrats and their media allies, if the market goes down it’s a clear sign that Trump’s tariff policy isn’t working. 

So if it goes up, like it did today, it must be a clear sign that Trump’s tariff policy IS"
2025-04-23T23:33:16.000Z,"The effects of 50%-65% tariff is the same as 145%: Chinese goods not coming to the US. Complete decoupling. 

China has been preparing for this moment since 2018 in Trump's 1st term. Good luck to the USA"
2025-04-23T23:22:58.000Z,"Wake up!!! Laws that hurt American people will be passed, if the GOP, Republicans get their way. We already pay sky high prices for groceries. Next it will be anything that Trump slapped a tariff on."
2025-04-23T23:47:26.000Z,"A problem is brewing...

Perhaps not all imported Gold Bullion into the US is Tariff Free?

Will drop more on this shortly.   (Quick Video?)"
2025-04-23T23:03:45.000Z,"The 2025 Spring Meetings of the World Bank Group and the International Monetary Fund in Washington, D. C. come amidst the tariff challenges and other evolving shifts that Jamaica must navigate! We have to keep our focus on macro-economic and fiscal stability! "
2025-04-23T23:33:11.000Z,"Yo Donnie, your tariff deal(s) pump is sputtering…whad up…"
2025-04-23T23:30:48.000Z,Tim Cook pressed for details on how Apple obtained Trump tariff exemptions
2025-04-23T23:46:47.000Z,Just in: the U.S. has declined to extend special tariff benefits for Japan.  Big moves on trade policies—what does this mean for future relations?  #TradeNews #USJapan #GlobalEconomy
2025-04-23T23:40:01.000Z,"A dozen states sued the Trump administration in the U.S. Court of International Trade in New York on Wednesday to stop its tariff policy, saying it is unlawful and has brought chaos to the American economy."
2025-04-23T23:30:41.000Z,"Trump says Canada would ‘cease to exist’ without U.S., floats automobile tariff increase https://calgary.citynews.ca/2025/04/23/trump-says-canada-would-cease-to-exist-without-u-s-floats-automobile-tariff-increase/…
Find out more at http://nationalnewswatch.com"
2025-04-23T23:46:33.000Z,"TRUMP, ÇIN'LE ANLAŞANA KADAR YÜZDE 145'LIK TARIFENIN INDIRILMEYECEĞINI BELIRTTI
(Trump stated that 145 percent tariff will not be reduced until an agreement is reached with China)

OKU: https://aa.com.tr/tr/guncel/trump-cinle-anlasana-kadar-yuzde-145lik-tarifenin-indirilmeyecegini-belirtti/3546926…

ABD Başkanı Donald Trump, Çin'e uyguladıkları yüzde 145'lik tarifenin"
2025-04-23T23:54:16.000Z,Huge decisions for Canadians to make in just days on who leads our country through this ongoing chaos from the U.S. And who is in Parliament to stand up for them.
2025-04-23T23:33:10.000Z,"Wr need a Liberal Majority  government. 
We need 
@MarkJCarney
 smarts and composure. 

I will be once again  voting 
@j_maloney
In my riding."
2025-04-23T23:03:27.000Z," Listen up, folks! DJ Tariff here, spinning the absolute BEST beats, believe me   #solana  #memecoin #memefi 
Join our Telegram: https://t.me/deejaytariffs"
2025-04-23T23:18:56.000Z,"""NV joins (12) states in suing the Trump administration to stop tariff policy...lawsuit challenges Trump's claim that he could arbitrarily impose tariffs based on the International Emergency Economic Powers Act.""

Gov to POTUS (probably): It's ain't me!"
2025-04-23T22:44:00.000Z,"This man is not well. He has no idea what a tariff is or how trade works. His numbers are made up. His reckless trade attacks are being felt worldwide, not just mainstreet. He must go!"
2025-04-23T23:57:31.000Z,A dozen states sue the Trump administration to stop tariff policy https://apnews.com/article/tariffs-lawsuit-what-states-sue-0d6531b7f60aaa2f7c6c35e0a944d4a9…
2025-04-23T23:10:17.000Z," Gold $GLD plunges 3.6%—biggest drop since 2013! 

 Trump’s softer stance on Fed’s Powell & easing US-China tariff fears spark sell-off. 

Gold futures hit $3,276.30/oz, down from $3,500 peak. 
Silver $SLV bucks trend, up 1.9%. 

YTD: Gold +25%, Silver +16%. ETFs $GDX $IAU"
2025-04-23T23:22:47.000Z,President Donald Trump said Wednesday that Canada would “cease to exist” if it weren’t for the United States while also suggested that he might increase import taxes on cars from Canada.
2025-04-23T23:41:56.000Z,No tariff on cookies and potato chips
2025-04-23T23:56:04.000Z,"Conrad Black: As Countries Seek Negotiations, Trump’s Tariff Strategy Is Going According to Plan https://theepochtimes.com/opinion/conrad-black-as-countries-seek-negotiations-trumps-tariff-strategy-is-going-according-to-plan-5841655?utm_source=ref_share&utm_campaign=twitter&rs=SHRNCMMW… via 
@epochtimes"
2025-04-23T23:30:07.000Z,"A dozen states have sued the Trump administration to stop its tariff policy, saying it is unlawful and has brought chaos to the American economy."
2025-04-23T23:09:47.000Z,"This administration is fully lost in the sauce. 

How could China see the US as strong, after the tariff shitshow and Trump’s pathetic pandering to Russia; a country with a comparatively tiny economy? Laughable.

I don’t know why 
@marcorubio
 isn’t hiding under the duvet in shame."
2025-04-23T23:52:14.000Z,"We have to conclude that whatever the intent, the implementation of the Trump tariff strategy has been a disaster. 

Picking an unnecessary fight our largest creditor and trading partner, China,was ill-advised"
2025-04-23T23:24:16.000Z,"Tariffs are awful for Americans and our economy, and it’s important to use every legal tool possible to reduce trade barriers and increase prosperity. Today, Colorado is standing up against 
@POTUS
 Trump’s recessionary tariff tax increase, which has been disastrous and is"
2025-04-23T23:22:12.000Z,About as stupid as the Gulf of America or Taking over Panama or Tariff Mania.
2025-04-23T23:48:10.000Z,President Trump has been President for a little over a hundred days.  You can't blame President Trump for three months of being at the helm.  This is all biden's work that President Trump is trying to fix not to mention previous presidents who were afraid of tariff wars.
2025-04-23T23:40:59.000Z,"On April 23, in response to U.S. comments about progress in China-U.S. trade agreement negotiations, China’s Ministry of Foreign Affairs stated: China(CCP)’s position on the U.S.-initiated tariff war is clear—we do not want a trade war, but we are not afraid of one. If the U.S."
2025-04-23T23:14:42.000Z,Thurs Apr24th 2025 US Strategy Update 7.30am -8.05a m Syd: Trump @ Education executive order signing repeats Tariff strategy 1. Allow income tax cuts 2. Increase Inv US $8trln so far 3. Powell wrong keep rates hi 4. YEN & Yuan too hi 5. CN deal coming 2-3wks? S&P500 fut 5393-5367
2025-04-23T23:39:31.000Z,"https://x.com/i/grok/share/tdwz80Liz7ubcVI6rGvNrNgca… 

Current tariff impact on Amazon EPS"
2025-04-23T22:47:34.000Z,"Thurs Apr24th 2025 US Strategy Update 6.00am Syd:  -ve Tariff impacts start show up in Apr25 Fed Beige Bk for May7th FOMC. Theme as per major falls US Consumer Confidence is that Tariffs increasing uncertainty demand, jobs & pricing with business trying adapt. S&P500 flat 5375"
2025-04-23T23:21:56.000Z,"Deescalation Phase of the Tariff War. Crypto Will Continue Upward.

#crypto #cryptodaily #cryptonews #cryptostrategy #btc #bitcoin #cardano #ada #xrp #ripple #ripplexrp #solana #sol #avalanche #avax #dogecoin #dollarcostaveraging #cryptobullrun #cryptocrash #cryptomarket"
2025-04-23T23:44:28.000Z,"Trump's wackadoodle tariff madness is economic Voodoo so taking it seriously is a waste of time. Nevertheless some good commentary by clever Scot 
@MkBlyth
."
2025-04-23T23:26:00.000Z,"A dozen states including Nevada sued the Trump administration in the U.S. Court of International Trade in New York to stop its tariff policy, saying it is unlawful and has brought chaos to the American economy.

Via AP: https://thenevadaindependent.com/article/nevada-joins-a-dozen-states-in-suing-the-trump-administration-to-stop-tariff-policy…"
2025-04-23T23:22:37.000Z,"Options Mosaic for 4/24/2025 (unabridged)
*************************************************

I caught 
@RiskReversal
 this afternoon on CNBC pointing out the first Trump administration kicked off the tariff war in early 2018 and that a deal was not struck until Jan 2020.  This time"
2025-04-23T23:52:29.000Z,"The Trump administration told Japan's trade delegation that it could not give Japan special treatment regarding its tariff measures, in response to Tokyo's strong demand for a review during the ministerial negotiations held earlier this month, NHK reported on Thursday"
2025-04-23T23:27:35.000Z,"I am imposing a 200% tariff on all unnecessary axes on all graphs, to compound per unnecessary axis."
2025-04-23T23:47:41.000Z,"I think most people would agree that there are a lot of unfair trade policies that are implemented against the United States. The current tariff plan and its implementation seem disorderly and rushed, and by taking on every nation at once, they have backed themselves into a"
2025-04-23T23:25:27.000Z,"Bitcoin Price Today: Bitcoin jumps to 7-week high of $93,000 as Trump eases tariff stance"
2025-04-23T23:26:48.000Z,"12 states sue Trump, claiming his tariff policies are unconstitutional"
2025-04-23T23:45:13.000Z,China says it wants Canada as a partner in pushing back against U.S. tariff ’bullying’ https://nationalpost.com/news/canada/canada-china-us-tariffs?taid=68097b88165b490001db9fe9&utm_campaign=trueanthem&utm_medium=social&utm_source=twitter…
2025-04-23T23:40:26.000Z,Yeah strength like we displayed in the tariff wars.  We got our ass handed to us.  And this is just the beginning.
2025-04-23T23:30:15.000Z,The lawsuit challenges Trump's claim that he could arbitrarily impose tariffs based on the International Emergency Economic Powers Act.
2025-04-23T23:22:00.000Z,"A dozen states are suing the Trump administration in the US Court of International Trade to stop its tariff policy, arguing it is unlawful and has brought chaos to the economy."
2025-04-23T23:01:33.000Z,12 states sue Trump administration to stop tariff policy https://bit.ly/446FQw4
2025-04-23T23:05:56.000Z,"Tobias Adrian, Financial Counsellor and Director of the IMF’s Monetary and Capital Markets Department, highlights both downside and upside risks for global markets amid rising tariff-related uncertainty."
2025-04-23T22:57:06.000Z,"Trump’s 100 days are almost up: 82% of Americans are still stressed about inflation, only 33% approve of his handling of it, and just 38% back his economic moves (Fox News). His approval’s at 41%, with tariff perception dragging him down. Time to shift gears, cut spending, boost"
2025-04-23T23:29:23.000Z,"RK Logistics Group expands Customs Bonded Warehouse and FTZ  capabilities in CA, TX, AZ, NY, and MI. With 15+ years of tariff  management expertise, we offer compliant, cost-effective solutions for  global trade. Get in touch to learn more: https://rklogisticsgroup.com/contact/

#SupplyChain"
2025-04-23T23:16:26.000Z,"Is this Trump’s François Mitterrand moment? That historic U-turn comes to mind as we watch the U.S. President execute a reversal by stages in his tariff agenda. https://wsj.com/opinion/francois-mitterrand-donald-trump-tariffs-trade-economy-markets-7e80c7e9?st=zFPB7q… via 
@WSJopinion"
2025-04-23T23:50:12.000Z,"Your stores sell more Items from China n the like, who are you helping?
Certainly not American Manufacturers!
Maybe more USA will be employed 

Trump Warned by Walmart, Target, and Home Depot CEOs That Disastrous Tariff Policy Will Lead to ‘Empty Shelves’ https://msn.com/en-us/money/companies/trump-warned-by-walmart-target-and-home-depot-ceos-that-disastrous-tariff-policy-will-lead-to-empty-shelves/ar-AA1DsLyT?ocid=socialshare…"
2025-04-23T23:37:00.000Z,The lawsuit said the policy put in place by President Donald Trump has left the national trade policy subject to Trump’s “whims rather than the sound exercise of lawful authority.”
2025-04-23T23:32:10.000Z,The states say the tariff policy is unlawful and has brought chaos to the American economy.
2025-04-23T23:16:07.000Z,literally he does not know what a tariff is
2025-04-23T23:54:05.000Z,"Tariff-induced price hikes, trade worries highlighted in Fed's Beige Book"
2025-04-23T23:51:27.000Z,"An uncertain tariff environment is a difficult challenge for manufacturers, but with some strategic thinking, you can keep up with the changing times. Learn more about how to protect your organization. #Tariffs #Manufacturing"
2025-04-23T23:53:24.000Z,Only a very stable genius would Tariff their Ass to the Target?
2025-04-23T23:14:41.000Z,"Experts warn the China trade war could spike US drug prices — without tariff exceptions, patients may face soaring costs https://aje.io/xwwdct"
2025-04-23T23:57:27.000Z," Position closed in profit 

 Opened with $343.75 debit
 Closed with $393.75 credit
 5 contracts, $250 profit
 13% return in 2 hours

We expected Wheat Futures $KE to correct on tariff uncertainty and shorted through Futures Options for a quick profit!"
2025-04-23T23:39:04.000Z,"France’s finance minister has urged the United States to strike a new trade agreement with Europe, warning that President Trump’s escalating tariff threats risk damaging transatlantic growth and global economic stability."
2025-04-23T23:42:50.000Z,"Trump should’ve just announced 10% baseline tariff for only countries w/ trade deficits but warned that some countries w/ high trade deficits could be potentially subject to ramp up of tariffs in the future. 

Then he should’ve meticulously planned out gradual ramp up of tariffs"
2025-04-23T23:20:14.000Z,Trump floats automobile tariff increase for Canada
2025-04-23T23:22:25.000Z,There is no way Congress delegated the typeof tariff setting powers POTUS is using. The product market anti dumping ones are fine. Will not be surprised to see Scotus sluse major question doctrine to deprive ieepa powers.
2025-04-23T23:05:00.000Z,"Which country will be the hardest hit amid global trade tensions and Trump's tit-for-tat tariff war? Nii Simmonds, Visiting Fellow with New America shares his insight. #biz #globalbiz #bizshow #IMF #WorldBank #WBGMeetings #IMFMeetings #SpringMeetings #TradeTensions #tariffs"
2025-04-23T23:52:07.000Z,"Dump is dump, lesser, greater, middling, makes no difference.
In the meantime, he is lifting the tariff on Xi ."
2025-04-23T22:53:09.000Z,Tariff related price increases have already begun and its looking ugly!
2025-04-23T23:00:38.000Z,"Apple's risks 'immeasurable' if U.S-Chinese tariffs escalate 

$AAPL #apple #imac #tariff #reciprocaltariffs #internationaltrade https://buff.ly/bODGzwL"
2025-04-23T23:11:49.000Z,"Whatever you think your 401(k) lost in this ""Trump tariff dip"" in the stock market, you lost FAR MORE under Bidenflation.

And that money's never coming back."
2025-04-23T23:51:31.000Z,"Tariff Agreements: Trump boasted that tariffs would generate trillions to offset the federal deficits, but as of today, no agreements in hand! Trump was expecting lines of countries outside his office, but so far, it's Zero. Reality setting in for Trump."
2025-04-23T23:16:03.000Z,"In a turbulent world, China's rationality this may present them with numerous opportunities to collaborate with businesses and investors from other countries that are disturbed by U.S. policies as well. #auspol #USpol"
2025-04-23T23:18:39.000Z,"Since close on April 8, tariff news has been ""less bad""."
2025-04-23T23:20:01.000Z,A dozen states sue the #Trump administration to stop tariff policy https://arab.news/m96sz
2025-04-23T23:59:05.000Z,Retreat! Capitulate! Is this Trump’s François Mitterrand moment? That historic U-turn comes to mind as we watch the U.S. President execute a reversal by stages in his tariff agenda.
2025-04-23T23:16:20.000Z,"“Eventually, the facts of his incompetence will overwhelm even the vast propaganda network that defends him. I just hope the economy doesn’t have to collapse for that to happen.”"
2025-04-23T23:30:13.000Z,"The states listed as plaintiffs in the lawsuit were Oregon, Arizona, Colorado, Connecticut, Delaware, Illinois, Maine, Minnesota, Nevada, New Mexico, New York and Vermont."
2025-04-23T23:28:16.000Z,"Trump Tariff Turmoil: Markets 'losing faith' in admin amid 'uncertainty ... https://youtu.be/1j7171z3f54?si=BT-CQY02s42Ev_WZ… via 
@YouTube"
2025-04-23T23:55:18.000Z,"[new video] CHINA TARIFF WAR is getting worse... (tariffs, Bitcoin, MARKET MOVES)

https://youtube.com/watch?v=8felmAVkKqo…"
2025-04-23T23:43:05.000Z,"“three of the nation's biggest retailers — Walmart, Target and Home Depot — privately warned him that his tariff and trade policy could disrupt supply chains… he was told that shelves will be empty… disruptions could become noticeable in two weeks”"
2025-04-23T22:40:13.000Z,"Twelve states filed a lawsuit against the Trump administration, arguing that its sweeping tariff policy is unlawful and economically damaging."
2025-04-23T23:11:23.000Z,"Global rebound lifts Wall St Wednesday:
 S&P 500: +1.7% to 5,375.86
 Dow: +1.1% to 39,606.57
 Nasdaq: +2.5% to 16,708.05
 Russell 2000: +1.5% to 1,919.14
Trump softens Fed &amp; tariff tone; yields ease, markets cheer"
2025-04-23T23:35:16.000Z,"Pretending not losing the tariff war after losing a kinetic war with Russia.
Denial will be the reason of the loss of US hegemony."
2025-04-23T23:20:19.000Z,I just ordered Mongolian Beef at PF Changs and there was a 145% tariff on the bill.
2025-04-23T23:48:24.000Z,"@NeonSunrise77
 @sheepdog_AF
 @OcrazioCornPop
 I agree, Bessent earns a B. He's skillfully navigated the China tariff mess, signaling de-escalation and boosting markets. His pragmatic approach and talks with 70+ countries show promise. But mixed messaging from the administration"
2025-04-23T23:20:15.000Z,"Brantford Has Been Hit Hard By Trump’s Tariffs. The City Still Might Go Conservative.

For 17 years, the Conservative Party has had a firm grip on this working-class city. Canada’s recent swing to the left may not change that."
2025-04-23T22:54:21.000Z,"Trump Warned by 
@Walmart
 @Target
 & 
@HomeDepot
 CEOs That Disastrous Tariff Policy Will Lead to 'Empty Shelves' so looks like they ARE GETTING WHAT THEY VOTED FOR. #Karma is paying them back.
https://mediaite.com/a/jsuzs via 
@mediaite"
2025-04-23T23:25:04.000Z,A dozen states sue the Trump administration to stop tariff policy
2025-04-23T23:29:02.000Z,"12 states sue Trump over tariff actions, saying it has ""brought chaos to the American economy"""
2025-04-23T23:09:39.000Z,"One important significance of this tariff war is that China is no longer worried about economic sanctions from the US if it liberats Taiwan in the future. Instead, it seems that the United States can't stand that China uses economic means to sanction the United States."
2025-04-23T23:34:18.000Z,"So, Donny’s only solution now is to take things back to where he started with his crazy tariff policies. That will fix everything, right? No, it won’t. Because of the massive loss of trust with the entire planet. It will take 50 years to fix that."
2025-04-23T23:48:16.000Z,"Carney Vies for Quebecers’ Support, Vowing to Protect Culture, Economy Amid US Tariff Threats"
2025-04-23T23:38:55.000Z,"""A dozen states sue the Trump administration to stop tariff policy"""
2025-04-23T23:37:12.000Z,Trump says 25% tariff on cars made in Canada could go up https://reuters.com/business/autos-transportation/trump-says-25-tariff-cars-made-canada-could-go-up-2025-04-23/… #cdnpoli
2025-04-23T23:43:45.000Z,"Trump floats automobile tariff increase for Canada https://kelownadailycourier.ca/news/national_news/article_ffb78210-68da-5f5b-8ca7-2a405dd601b6.html?utm_medium=social&utm_source=twitter&utm_campaign=user-share… via 
@KelownaCourier"
2025-04-23T23:31:18.000Z,"A dozen states sue the Trump administration to stop tariff policy https://omaha.com/news/nation-world/business/economy/article_4bdb43d2-b550-567f-900d-8d7571d7bf99.html?utm_medium=social&utm_source=twitter&utm_campaign=user-share… via 
@owhnews"
2025-04-23T23:45:27.000Z,Tariff Lobbyist Spending Is Up 277 Percent Over Last Year
2025-04-23T23:47:08.000Z,"Current tariff policy is, it changes daily.  Pure chaos."
2025-04-23T23:26:38.000Z,"**Trump to grant auto giants tariff relief  $GM $F $TSLA stock sees post-market gains  Stay sharp on market moves!**

Via MarketWatch"
2025-04-23T23:53:29.000Z,Oil Prices Fall To Four-Year Lows As US Mulls Tariff Cuts On Chinese Imports
2025-04-23T23:52:23.000Z,"I'd give Scott Bessent a B as Treasury Secretary. His tariff talks with China and tax cut push have kept markets optimistic, but mixed messaging and deficit concerns hold him back. Economic indicators show slowing growth, though trade improvements help. It's a solid but not"
2025-04-23T23:27:49.000Z,".
@CBCNews
 Your World Tonight covers Trump’s fresh tariff hike and 51st state threats, and $200B subsidy claim made in the Oval 90 minutes ago. The news cycle begins anew."
2025-04-23T23:40:57.000Z," #Bitcoin ETFs in ROCKET MODE!

 $912 MILLION entered in a single day. Nearly a record high!

 Optimism for:
 Trump's tariff truce
 Institutional fever

#CryptoBoom #BTC #ToTheMoon
 https://steemit.moecki.online/bitcoin/@bitacademyweb/wave-of-capital-floods-bitcoin-etfs…

 Do you think we'll surpass ATH? GIVE YOUR OPINION! "
2025-04-23T23:22:32.000Z,"S&P gonna run!

$BTC gonna moon!

First Ukraine
Next Tariff and China! https://x.com/DougAMacgregor/DougAMacgregor/status/1915162613690098149…"
2025-04-23T23:16:33.000Z,"Constantly bombarded each day with new pros and cons of this tariff situation. 

At least it’s never boring!"
2025-04-23T23:18:24.000Z,"Trump floats automobile tariff increase for Canada https://wellandtribune.ca/business/trump-floats-automobile-tariff-increase-for-canada/article_681dbc90-8ead-5a80-b3c6-38f663982a10.html?utm_medium=social&utm_source=twitter&utm_campaign=user-share… via 
@WellandTribune"
2025-04-23T23:46:59.000Z,Japan is considering using increased rice imports from the U.S. as a negotiating tool in tariff talks with the Trump administration.
2025-04-23T23:48:29.000Z,"Bitcoin and Crypto Are Surging: Here’s What’s Fueling the Rally

#Trump's tariff shift, #Powell stability and record #Bitcoin ETF inflows spark fresh optimism in digital assets

$BTC $ETH $XRP $SOL $IBIT $FBTC $ARKB $BITB $FETH $BLK $SPX

#Ethereum #Crypto"
2025-04-23T23:33:53.000Z,"Recap of the past 2 weeks in crypto :

- $BTC double bottomed at $75k in early April then pumped on the 90-day tariff pause, ranged around $84k for 2 weeks and then pumped to $94k in two days. Significant relative strength vs equities.

- Dead altcoin market until the recent"
2025-04-23T23:41:55.000Z,"That news report regarding 10B for solar still de make me cry till now, 

You introduced the tariff  to us, we both continued the game, I’am inferior you’re superior, you now backed out because of the cost towards your trillions 

ENKR"
